Variable,Description
country,Country name
days_since_outbreak,Count of days passed since Covid-19 outbreak began
household_contacts,Number of household contacts for the previous day (averaged by country)
total_contacts,Total number of contacts for the previous day (averaged by country)
times_left_home,Number of times the respondent left the house on the previous day (averaged by country)
handwashes,Number of times the respondent washed their hands on the previous day (averaged by country)
masks_outside,Score (0-100) related to how often the respondent wears a mask outside (100 = all the time)
majority_life_impacted,"majority of respondents say their live is greatly impacted by COVID (majority says so = 1, majority doesn’t say so = 0)"
